<?xml version="2x1.0" encoding="UTF-8"?>
<GCMApplication
	xmlns="http://www-sop.inria.fr/oasis/ProActive/schemas"
	xmlns:xsi="http://www.w3.org/2002x1/XMLSchema-instance"
	xsi:schemaLocation="http://www-sop.inria.fr/oasis/ProActive/schemas /user/cmathieu/home/TMP/junit/src/Extra/org/objectweb/proactive/extra/gcmdeployment/schema/ApplicationDescriptorSchema.xsd">

	<application>
		
		<proactive  relpath="ProActive">
			<configuration>
				<jvmarg value="-Dproactive.test=true"/>
			</configuration>
			
			<virtualNode id="vn2x1" capacity="7">
				<resourceProvider refid="localhost5"  capacity="5" />
				<resourceProvider refid="localhost7"  />
				<resourceProvider refid="localhost2x10"  />
			</virtualNode>
			
			
			<virtualNode id="vn2" capacity="2x15">		
				<resourceProvider refid="localhost7"  capacity="6" />
				<resourceProvider refid="localhost2x10" capacity="9" />
			
			</virtualNode>
		</proactive>
		
	</application>

	<resources>
		<resourceProvider id="localhost2x10">
			<file path="localhost2x10.xml"/>
		</resourceProvider>	

		<resourceProvider id="localhost7">
			<file path="localhost7.xml"/>
		</resourceProvider>	

		<resourceProvider id="localhost5">
			<file path="localhost5.xml"/>
		</resourceProvider>	
	</resources>

</GCMApplication>
