<?xml version="1.0" encoding="UTF-8"?>

<GCMApplication
	xmlns="http://www-sop.inria.fr/oasis/ProActive/schemas/ApplicationDescriptorSchema"
	xmlns:xsi="http://www.w3.org/2001/XMLSchema-instance"
	xsi:schemaLocation="http://www-sop.inria.fr/oasis/ProActive/schemas/ApplicationDescriptorSchema ../schema/ApplicationDescriptorSchema.xsd">

	<resourceProvider id="INRIA_LAN">
		<file path="deployment.xml" />
	</resourceProvider>

	<application>
		<resourceProvider refid="INRIA_LAN" />
		<!-- 
			<command refid="myscript">
			<command name="uname">
		-->
		<command relpath="toto.sh">
			<arg>-D</arg>
			<arg>-O</arg>
			<!-- Or <args></args> -->

			<filetransfer>
				<source path="outputDir" />
				<dest relpath="/user/cmathieu/home/results/" />
			</filetransfer>
		</command>

	</application>

</GCMApplication>
